Set,Red Box,RED
Prompt,"Yeah that's so hot.
I'm so close.
Talk about ______ again!
OH I'M CUMMING!",
Prompt,"You can call me David Copperfield, because I'm about to make ______ disappear.",
Prompt,You city folk would never understand the quiet dignity of _______.,
,,
Response,A 12-foot scepter of bone.,
Response,A basketball that screams every time it gets bounced.,
Response,A bear.,
Response,A big hole.,
Response,A big hot fire that's burning everybody.,
Response,"A big, big, big, and I mean BIG big.",
Response,"A big, sloppy blowjob from a mean, tired cowboy.",
Response,A bird that dies.,
Response,A bold red lip.,
Response,"A button that when you press it, there's jazz.",
Response,A crab rangoon.,
Response,A cat with… hands.,
Response,A Christmas feast of goose and jellies.,
Response,A concerning amount of white people.,
Response,A couple of cold ones.,
Response,A family of raccoons.,
Response,A four-hour depression nap.,
Response,A full-on panic attack.,
Response,A garbage clown who makes no one laugh and should die.,
Response,A hamburger on a string that keeps getting pulled away.,
Response,A hateful 30-year marriage.,
Response,A little boy with big dreams and potatoes for hands.,
Response,A little girl with a knife.,
Response,A little sewer girl strangling a pigeon.,
Response,A little taste of penis.,
Response,A magician fucking up over and over again.,
Response,A penis that gets too hard and explodes blood.,
Response,A piping-hot casserole filled with beans and hair.,
Response,A poop emergency.,
Response,A powerful philosopher named Brainhead.,
Response,A Pringle.,
Response,A Puerto Rican minotaur from the Bronx.,
Response,A racist boomerang that only comes back if you're white.,
Response,A real cum-dumpster of a saxophonist.,
Response,A real job with insurance and your taxes taken out and everything.,
Response,A sticky tree hole full of pancake sauce.,
Response,A stinky hoo-ha.,
Response,A toothless woman gumming on a peach.,
Response,A urinary tract infection.,
Response,A vagina that beatboxes when it's horny.,
Response,A whole different way of talking called Spanish.,
Response,Accusing a powerful man of sexual assault.,
Response,Acquiring a gun very easily.,
Response,Acting white.,
Response,All manners of honors.,
Response,All my dead sisters.,
Response,"All types of girls, even ugly ones.",
Response,An 800-foot-long pool noodle.,
Response,An ambitious woman who wears pants.,
Response,An elite squad known as the Special Victims Unit.,
Response,Anything Asian.,
Response,As ass like a bag of pool balls.,
Response,Assembling IKEA furniture.,
Response,Beef.,
Response,Being hunted by giant eagles.,
Response,Being inside me.,
Response,Being seen reading Infinite Jest.,
Response,Being shitty to everyone and late for everything.,
Response,Big beefy baseball boys.,
Response,Big Italian women making the spicy sauce.,
Response,"Bimpy, the small styrofoam ball we all jack off into.",
Response,Bipolar Disorder.,
Response,Blowing into the penis so that the balls inflate.,
Response,Blue smoke coming out of my anus.,
Response,Canada's worst mangoes.,
Response,Carbs.,
Response,Carlos Santana's horrible wailing guitar.,
Response,"Certain things, but not others.",
Response,Chinese people.,
Response,Chowder.,
Response,"Clearly asking for no cucumbers in my salad, and yet here we are.",
Response,Clippy from Microsoft Office.,
Response,Colluding with Russia.,
Response,Corn.,
Response,Country music legend Toby Keith.,
Response,"Crunchy snacks for big, flappy mouth.",
Response,Cultural appropriation.,
Response,Curly fries so good you quit ISIS.,
Response,Dating a Republican.,
Response,Death.,
Response,Déjà vu.,
Response,Déjà vu.,
Response,Denying climate change.,
Response,Doing ho shit.,
Response,"Doing it doggy, no kissing.",
Response,Doing stuff bad.,
Response,Drake.,
Response,Driving to a Walmart parking lot and staring into the distance for eight hours.,
Response,Eating pussy bad.,
Response,Ejaculating a quart of hollandaise sauce.,
Response,Elon Musk.,
Response,Enticing a hummingbird to drink nectar out of my urethra.,
Response,Fascism.,
Response,Fat.,
Response,Fingering each other's buttholes.,
Response,Foul vegan shits.,
Response,Free two-day shipping with Amazon Prime.,
Response,Fresh Air with Terry Gross.,
Response,Funneling money through a series of shell companies.,
Response,Getting #MeToo'd.,
Response,Getting banished to the Shadow Realm.,
Response,Getting depressed and super fat.,
Response,Getting fisted by a man with no fingers.,
Response,Getting half-hard and trying to smoosh it in.,
Response,Getting herpes from Bruce Willis.,
Response,Getting Mommy another beer.,
Response,"Getting tanned, jacked, and juicy.",
Response,"Going ""oink oink"" like a nasty little pig boy.",
Response,"Good, clean Christian comedy.",
Response,Having tuna sandwiches with my favorite honkies.,
Response,Hard-hitting investigative journalism.,
Response,Having a wonderful time at the zoo.,
Response,"Having no legs, just toes.",
Response,Having thirty sons named Chad.,
Response,Healthcare.gov.,
Response,Hiding from border patrol.,
Response,"Hiking up a hillside covered in bear semen yelling ""I'm the queen of the forest!""",
Response,"Hoopnugget, the game where you throw a nugget into a hoop.",
Response,How many bagels I can fit on my penis.,
Response,How quiet the forest is.,
Response,Huffing and puffing and blowing my stepdad.,
Response,Hunting white men for sport.,
Response,Hush money.,
Response,Interrupting women.,
Response,"Jeremy and his stupid, annoying, dumb, hard, beautiful body.",
Response,Jörmungandr the World Serpent.,
Response,"Joyless, wooden Soviet toys.",
Response,Just a Luna bar for lunch.,
Response,Kanye West but if he were an old Japanese farmer.,
Response,Korean barbecue.,
Response,Leading a country to war on false pretenses.,
Response,Leading children around with a magical flute.,
Response,Letting that pussy breathe.,
Response,Letting this loser eat me out.,
Response,Licking the toilet as Mistress commands.,
Response,Life.,
Response,"Little Debbie and her mom, Full-Size Deborah.",
Response,Lotion.,
Response,Loving America.,
Response,Magic: The Gathering.,
Response,Making direct eye contact with a horse's asshole.,
Response,Mark Zuckerberg.,
Response,Maybe getting a little involved in selling heroin sometimes.,
Response,Melania Trump.,
Response,Murdering our parents.,
Response,My buddy Jeff.,
Response,My daughter fucking my boyfriend.,
Response,My math teacher's bulge.,
Response,My real dad.,
Response,My secret butt.,
Response,My son's dipshit friends.,
Response,My son's husband's huge cock.,
Response,"My wife.
(in Borat voice)",
Response,Naked Dad.,
Response,Netflix.,
Response,New DNA evidence exonerating OJ Simpson.,
Response,Nipples the size of CDs.,
Response,None of your damn business.,
Response,"Nonsexual activiities, such as roller skating.",
Response,Not being a part of my son's life.,
Response,Oral.,
Response,Outdated gender norms.,
Response,Owing a lot of money to some very bad people.,
Response,Panda Express.,
Response,Panic and confusion.,
Response,Pissin' me paants.,
Response,Politics.,
Response,Poppin' that pussy.,
Response,Preparing my asshole for sex.,
Response,Pretending golf is fun.,
Response,Prison.,
Response,"Pulling a sick, shit-covered raccoon out of the toilet and nursing it back to health.",
Response,Pulling the butt cheeks apart so the fart comes out quieter.,
Response,Pushing my boob up to lick the nipple.,
Response,Putting dirty dishes in the sink and hoping someone else deals with them.,
Response,"Quality, affordable menswear.",
Response,Reparations for slavery.,
Response,Representing the entire black community.,
Response,Respecting woman.,
Response,Rubbing my clit with a handgun.,
Response,Sandwich.,
Response,Schindler's List.,
Response,Setting boundaries with co-workers.,
Response,Sewing two hamsters together to make a Double Hamster Supreme.,
Response,Shit.,
Response,Shitting perfectly into a hot dog bun.,
Response,Slaves.,
Response,Slowly releasing a huge fart over the course of two minutes.,
Response,"Sluts, whores, and bitches.",
Response,"Small plates, or tapas if you will.",
Response,Some cracker-ass motherfucker.,
Response,Some light choking.,
Response,Square dancing with other racists.,
Response,Stapling a butterfly to a cow.,
Response,Staying hydrated.,
Response,Sticking my hard rat dick in my girlfiend's wet rat pussy.,
Response,Substituting sweet potato fries for $2.,
Response,Sucking the caviar straight out of a fish's pussy.,
Response,Suddenly feeling really sad for 40 years.,
Response,Swordplay.,
Response,Taking a dump.,
Response,Tar.,
Response,The Asshole Destroyer 3000.,
Response,The Audi Sign-and-Drive Sales Event.,
Response,The awesome power of the Lord.,
Response,The beautiful backpacks of JanSport.,
Response,The boy who sucks the farts our of my sweatpants.,
Response,The coming race war.,
Response,The current political climate.,
Response,The cutest fucking shoes I've ever seen.,
Response,The end of all life on Earth.,
Response,The express written consent of the National Basketball Association.,
Response,The fact that time is moving backwards right now and nobody's noticing.,
Response,The harsh reality that all horses are people in horse costumes.,
Response,"The incredible Gary, he'll suck your nipples.",
Response,The kind of porn with poop.,
Response,The King of Jews.,
Response,The little-known fact that Polish people don't dream.,
Response,The man in the basement.,
Response,The man who fucks me and my wife.,
Response,The Moon.,
Response,The NRA.,
Response,The pelican that will one day eat Scarlett Johansson's baby.,
Response,The persecution of Buddhists by the American-backed government of South Vietnam.,
Response,The pleasure of watching my boys wolf down my pot roast and scamper into the woods.,
Response,The rock after which Dwayne Johnson was named.,
Response,The South rising again.,
Response,"The wonderful giant spoon known as ""ladle.""",
Response,"The world's largest baby, weighing over 700 pounds.",
Response,The worm that ate my penis and is now my penis.,
Response,These breasts of mine.,
Response,This boring-ass white bitch from work.,
Response,This kid I found.,
Response,Thoughts and prayers.,
Response,Three men and three hot dogs.,
Response,Throwing a man by his big penis.,
Response,Thrusting and grunting.,
Response,"Thumb, the King of the Fingers.",
Response,"Tiny, sour kisses from a lemon dwarf.",
Response,Travolta.,
Response,Trees with human skin.,
Response,Turning poor people against each other so they don't pay attention to economic inequality.,
Response,"Twirling a cane, popping it into my anus, and giving a tip of the top hat.",
Response,Uncles.,
Response,Uncut daddy dick.,
Response,Violating the Geneva Convention.,
Response,Voldemort.,
Response,Voter suppression.,
Response,What looked like a chemical weapons facility but turned out to be a children's hospital.,
Response,Women in positions of power.,
Response,Yo stanky ass.,
Response,Yogurt that moans in pleasure as you eat it.,
Response,Your little booty in them underpants.,
Response,Your mouth.,
Response,Yummy yummy yummy yummy rat pussy.,
Set,Box Pack,BOX
Response,"A box of biscuits, a box of mixed biscuits, and a biscuit mixer.",
Response,A box that is conscious and wishes it weren't a box.,
Response,A box within a box.,
Response,"A box without hinges, key, or lid, yet golden treasure inside is hid.",
Response,A box-shaped man.,
Response,A box.,
Response,A boxing match with a giant box.,
Response,A falcon with a box on its head.,
Response,A man-shaped box.,
Response,A world without boxes.,
Response,An alternate universe in which boxes store things inside of people.,
Response,An outbreak of smallbox.,
Response,Being a motherfucking box.,
Response,Boxing up my feelings.,
Response,Former President George W. Box.,
Response,Pandora's vagina.,
Response,Something that looks like a box but turns out to be a crate.,
Response,The Boxcar Children.,
Response,The J15 Patriot Assault Box.,
Response,Two midgets shitting into a box.,
Response,"The biggest, blackest dick.",
Response,A dick so big that it is a problematic stereotype.,
Response,"The even biggest, blackester dick.",
Set,Procedural Pack,PROC
Response,A funny little boss with an epic pair of nipples.,
Response,A muscular cop with an epic pair of tits.,
Response,A happy wizard with the world's biggest dick.,
Response,A moaning wizard with a sopping wet asshole.,
Response,A dentist with a sopping wet pecker.,
Response,A huge surgeon with a hairy scrotum.,
Response,A trembling woman with the world's biggest asshole.,
Response,A smiling Rabbi with a weird ballsack.,
Response,An otherwise unremarkable woman with an epic ballsack.,
Response,A cranky surgeon with a glorious pussy.,
Response,A fat horse with a spectacular ballsack.,
Response,A regular Rabbi with a glistening scrotum.,
Response,A trembling grandfather with history's greatest twat.,
Response,A cranky hunk with a perfectly-formed asshole.,
Response,A hard-working nerd with a weird scrotum.,
Response,A cranky congressman with an impressive scrotum.,
Response,A lonely farmer with a glorious pair of nipples.,
Response,A winking Batman with a crappy pair of nipples.,
Response,Yet another surgeon with a creamy pecker.,
Response,An average dentist with a glorious scrotum.,
Response,"A happy President with a tiny, upsetting dong.",
Response,A regular garbageman with a creamy pair of tits.,
Response,A happy Republican with a perfectly-formed butthole.,
Response,A hard-working milkman with an impressive dick.,
Response,A moaning novelist with a smooth dingus.,
Response,A huge dad with a smooth penis.,
Response,An eager nurse with a shit-covered taint.,
Response,A mean garbageman with a smooth erection.,
Response,A winking milkman with a glorious pair of nipples.,
Response,A muscular prince with a spectacular twat.,
Response,Yet another grandfather with an inspiring dong.,
Response,A large farmer with a surprisingly large taint.,
Response,Some kind of nurse with a creamy taint.,
Response,A funny little bro with a glorious pair of tits.,
Response,An ordinary woman with a glistening twat.,
Response,A tall Republican with a spectacular pair of tits.,
Response,A hard-working milkman with the world's smallest vagina.,
Response,An eager nerd with a crappy taint.,
Response,A cranky CEO with the world's biggest dingus.,
Response,A huge fireman with history's greatest anus.,
Response,A hot school teacher with an inspiring vagina.,
Response,An ordinary CEO with a perfectly-formed scrotum.,
Response,"A huge dragon with a tiny, upsetting pussy.",
Response,A muscular Batman with a tremendous ballsack.,
Response,A gay wizard with an inspiring asshole.,
Response,An ordinary bro with a shit-covered penis.,
Response,A happy woman with a beautiful dick.,
Response,A tall Republican with a glorious cock.,
Response,A gay prince with a sopping wet vagina.,
Response,A fat cop with a surprisingly large erection.,
Response,A horny woman with a surprisingly large penis.,
Response,A happy woman with a shit-covered cock.,
Response,A muscular milkman with a glistening dick.,
Response,A trembling guy with an extra erection.,
Response,Some kind of god with a surprising large asshole.,
Response,A winking congressman with a creamy asshole.,
Response,Some kind of woman with a sopping wet clitoris.,
Response,A fat guy with a beautiful scrotum.,
Response,A tiny prince with a perfectly-formed dick.,
Response,A sad nerd with a glorious vagina.,
Response,A gorgeous grandfather with history's greatest butthole.,
Response,A lonely boss with a wonderful asshole.,
Response,A hard-working guy with a crappy clitoris.,
Response,A gay fireman with a sopping wet vagina.,
Response,A gorgeous cop with a sopping wet penis.,
Response,A tiny Batman with the world's smallest pair of nipples.,
Response,An otherwise unremarkablenurse with history's greatest scrotum.,
Response,A gay nurse with a glorious anus.,
Response,A gay CEO with a shit-covered dong.,
Response,An average garbageman with an infinite vagina.,
Response,A grandfather with a creamy dingus.,
Response,A smiling prince with a sopping wet dingus.,
Response,A laid-back prince with the world's biggest butthole.,
Response,A trembling mom with a shit-covered asshole.,
Response,A hard-working grandfather with a surprisingly large dingus.,
Response,A horny mom with an infinite cock.,
Response,A horny surgeon with a weird dong.,
Response,A gorgeous dragon with a spectacular twat.,
Response,An otherwise unremarkable god with a shit-covered vagina.,
Response,A mean CEO with a wonderful taint.,
Response,A tiny school teacher with history's greatest pair of tits.,
Response,A happy Rabbi with a chocolate-covered ballsack.,
Response,An eager cop with an extra ballsack.,
Response,A hot hipster with the world's smallest pair of nipples.,
Response,Some kind of hunk with a shit-covered dingus.,
Response,A tiny dentist with a sopping wet taint.,
Response,A muscular woman with the world's biggest pair of nipples.,
Response,A mean President with a perfectly-formed clitoris.,
Response,A winking god with a weird ballsack.,
Response,A trembling teacher with a weird ballsack.,
Response,A smiling farmer with the world's biggest pussy.,
Response,A sad god with a shit-covered pair of nipples.,
Response,A hard working nerd with a weird scrotum.,
Response,An otherwise unremarkable mom with a glistening dingus.,
Response,An average dragon with a glistening clitoris.,
Response,A large dog with a weird taint.,
Response,A huge cop with a perfectly-formed clitoris.,
Response,Yet another Batman with an epic pecker.,
Response,A moaning mom with a shit-covered ballsack.,
Response,A gay fireman with an impressive anus.,
Response,A laid-back superhero with an extra taint.,
Response,A fat Batman with a sopping wet scrotum.,
Response,A laid-back hipster with a crappy ballsack.,
Response,A lonely dentist with an inspiring taint.,
Response,A hot bro with a hairy dick.,
Response,A laidback horse with a crappy twat.,
Response,An ordinary dragon with a surprisingly large pair of tits.,
Response,An ordinary prince with a beautiful pussy.,
Response,A tall nurse with a hairy penis.,
Response,A mean nerd with an epic anus.,
Response,A sexy dragon with a spectacular ballsack.,
Response,A huge Rabbi with the world's biggest cock.,
Response,A muscular hunk with an epic asshole.,
Response,A mean nerd with a creamy twat.,
Response,A winking garbageman with an infinite dong.,
Response,A tall boss with a creamy pair of nipples.,
Response,A sad novelist with history's greatest penis.,
Response,A fat horse with a crappy scrotum.,
Response,A moaning nurse with a tremendous dingus.,
Response,A laid-back boss with an inspiring pussy.,
Response,A sad hunk with an extra ballsack.,
Response,A trembling hunk with history's greatest twat.,
Response,A horny grandfather with a smooth dong.,
Response,A laid-back dog with the world's smallest scrotum.,
Response,A trembling farmer with a wonderful scrotum.,
Response,Some kind of cop with a hairy dick.,
Response,A happy priest with a hairy pair of tits.,
Response,An otherwise unremarkable dad with a sopping wet dingus.,
Response,A sexy dog with a sopping wet cock.,
Response,An ordinary novelist with a smooth penis.,
Response,An eager farmer with a beautiful pussy.,
Response,A gay hipster with an impressive taint.,
Response,An otherwise unremarkable dragon with a smooth clitoris.,
Response,A tiny woman with a chocolate-covered cock.,
Response,A large garbageman with an infinite dong.,
Response,An otherwise unremarkable nurse with history's greatest scrotum.,
Response,A regular grandfather with a creamy dingus.,
Response,"Some kind of milkman with a tiny, upsetting penis.",
Response,A winking novelist with a tremendous dingus.,
Response,A hot grandfather with an extra scrotum.,
Response,A lonely god with an extra pussy.,
Response,A sad mom with a glorius anus.,
Response,A laid-back superhero with the world's biggest anus.,
Response,An average fireman with the world's smallest penis.,
Response,A happy Rabbi with an epic erection.,
Response,A gorgeous dancer with an impressive erection.,
Response,A sad superhero with a sopping wet anus.,
Response,A moaning garbageman with a glistening asshole.,
Response,A gay cop with a sopping wet asshole.,
Response,A hot novelist with a crappy dick.,
Response,A cranky god with a crappy asshole.,
Response,A tall Rabbi with the world's biggest vagina.,
Response,A lonely Batman with a crappy dingus.,
Response,A horny farmer with a weird cock.,
Response,A huge god with a perfectly-formed taint.,
Response,"A happy Rabbi with a tiny, upsetting butthole.",
Response,Some kind of congressman with a glistening cock.,
Response,A regular prince with an extra taint.,
Response,A happy bro with an infinite cock.,
Response,A horny guy with a wonderful ballsack.,
Response,An ordinary cop with a chocolate-covered ballsack.,
Response,A laid-back congressman with a perfectly-formed taint.,
Response,An eager school teacher with a glorious cock.,
Response,A gay prince with a crappy butthole.,
Response,A huge bro with a glorious taint.,
Response,A regular hipster with an extra dingus.,
Response,A moaning fireman with an infinite anus.,
Response,A hot priest with a shit-covered dingus.,
Response,A sexy farmer with a creamy penis.,
Response,A sad boss with a weird dingus.,
Response,A laid-back priest with a tremendous ballsack.,
Response,A gay prince with history's greatest cock.,
Response,A laid-back horse with a wonderful scrotum.,
Response,A tall milkman with a sopping wet ballsack.,
Response,A happy dancer with an impressive scrotum.,
Response,The most gorgeous president with the greatest dick.,
Response,"An otherwise unremarkable baseball player with a tiny, upsetting twat.",
Response,Yet another astronaut with a creamy twat.,
Response,A hot baseball player with a weird asshole.,
Response,An otherwise unremarkable novelist with an impressive clitoris.,
Response,An otherwise unremarkable bro with a glorious pair of tits.,
Response,A muscular prince with a glorious anus.,
Response,"An ordinary Republican with a tiny, upsetting cock.",
Response,A large hipster with a weird ballsack.,
Response,"A winking astronaut with a tiny, upsetting pecker.",
Response,"A laid-back Rabbi with a tiny, upsetting erection.",
Response,A sexy guy with an epic penis.,
Response,A winking woman with a creamy penis.,
Response,A lonely nurse with an epic pair of nipples.,
Response,A happy guy with a chocolate-covered taint.,
Response,A laid-back President with the world's biggest vagina.,
Response,A gorgeous mom with a beautiful erection.,
Response,A tall President with an infinite vagina.,
Response,A fat nurse with a surprisingly large anus.,
Response,A mean plumber with an impressive vagina.,
Response,A happy baseball player with quite a clit.,
Response,A mean school teacher with a glistening butthole.,
Response,A gay donkey with an infinite dong.,
Response,A tiny baseball player with a sopping wet scrotum.,
Response,Yet another superhero with a smooth dong.,
Response,A gorgeous plumber with a spectacular taint.,
Response,A hot congressman with history's greatest asshole.,
Response,Some kind of dad with a tremendous scrotum.,
Response,"A tiny baseball player with a tiny, upsetting clit.",
Response,Yet another guy with an impressive dick.,
Response,Some kind of astronaut with quite a pussy.,
Response,A gorgeous nurse with an extra pair of tits.,
Response,A winking garbageman with a sopping wet pussy.,
Response,A fat surgeon with a creamy dingus.,
Response,A fat hipster with a beautiful asshole.,
Response,A cranky god with the world's smallest pecker.,
Response,A winking CEO with a crappy asshole.,
Response,A winking Republican with a weird penis.,
Response,"A horny dentist with a tiny, upsetting pair of tits.",
Response,A horny Republican with an impressive butthole.,
Response,A hard-working hunk with a tremendous vagina.,
Response,A fat school teacher with an infinite twat.,
Response,A cranky superhero with a surprisingly large cock.,
Response,An ordinary dentist with the world's smallest vagina.,
Response,A laid-back donkey with a spectacular scrotum.,
Response,A laid-back doneky with a spectacular erection.,
Response,A laid-back school teacher with an impressive butthole.,
Response,A fat wizard with a tremendous vagina.,
Response,A hard-working garbageman with a tremendous taint.,
Response,A horny woman with a shit-covered dingus.,
Response,A laid-back dad with a smooth clitoris.,
Response,A horny garbageman with a chocolate-covered clitoris.,
Response,A sexy husband with a surprisingly large dong.,
Response,A gay superhero with a creamy vagina.,
Response,A tall nurse with a spectacular ballsack.,
Response,A hard-working milkman with a tremendous cock.,
Response,A gay Republican with a beautiful dick.,
Response,A happy grandma with a surprisingly large penis.,
Response,A trembling dog with history's greatest penis.,
Response,A hard-working superhero with an extra asshole.,
Response,A horny woman with a wonderful clitoris.,
Response,An ordinary school teacher with a creamy clitoris.,
Response,Some kind of CEO with a smooth dick.,
Response,A trembling milkman with a perfectly-formed erection.,
Response,An average dad with a tremendous ballsack.,
Response,A gorgeous cop with a surprisingly large pair of nipples.,
Response,A moaning nurse with a shit-covered butthole.,
Response,A tall surgeon with an inspiring dick.,
Response,A wizard with a chocolate-covered scrotum.,
Response,A huge woman with an impressive penis.,
Response,Yet another nerd with a smooth ballsack.,
Response,A sad astronaut with a creamy cock.,
Response,An eager prince with a sopping wet twat.,
Response,A hot god with a beautiful scrotum.,
Response,Yet another President with a wonderful dick.,
Response,A sexy milkman with a perfectly-formed erection.,
Response,A muscular garbageman with a sopping wet pussy.,
