Set,Red Box,RED
Prompt,______ would be woefully incomplete without ______.,PICK 2
Prompt,______: Hours of fun. Easy to use. Perfect for ______!,PICK 2
Prompt,"______. Awesome in theory, kind of a mess in practice.",
Prompt,A remarkable new study has shown that chimps have evolved their own primitive version of ______.,
Prompt,A successful job interview begins with a firm handshake and ends with ______.,
Prompt,"After months of practice with ______, I think I’m finally ready for ______.",PICK 2
Prompt,"And I would have gotten away with it, too, if it hadn't been for ______!",
Prompt,And what did you bring for show and tell?,
Prompt,"As part of his contract, Prince won’t perform without ______ in his dressing room.",
Prompt,"As part of his daily regimen, Anderson Cooper sets aside 15 minutes for ______.",
Prompt,"Awww, sick! I just say this skater do a 720 kickflip into ______!",
Prompt,"Before ______, all we had was ______.",PICK 2
Prompt,"Before I run for president, I must destroy all evidence of my involvement with ______.",
Prompt,"Call the law offices of Goldstein & Goldstein, because no one should have to tolerate ______ in the workplace.",
Prompt,Charades was ruined for me forever when my mom had to act out ______.,
Prompt,"Dear Sir or Madam, We regret to inform you that the Office of ______ has denied your request for ______.",PICK 2
Prompt,"Doctor, you've gone too far! The human body wasn't meant to withstand that amount of ______!",
Prompt,During high school I never really fit in until I found ______ club.,
Prompt,"During his midlife crisis, my dad got really into ______.",
Prompt,Finally! A service that delivers ______ right to your door.,
Prompt,Future Historians will agree that ______ marked the beginning of America's decline.,
Prompt,Having problems with ______? Try ______!,PICK 2
Prompt,"Hey baby, come back to my place and I’ll show you ______.",
Prompt,I learned the hard way that you can't cheer up a grieving friend with ______.,
Prompt,I love being a mom. But it's tough when my kids come home filthy from ______. That's why there's Tide®.,
Prompt,"I spent my whole life working toward ______, only to have it ruined by ______.",PICK 2
Prompt,"I went from ______ to ______, all thanks to ______.","DRAW 2, PICK 3"
Prompt,I’m not like the rest of you. I’m too rich and busy for ______.,
Prompt,"If God didn't want us to enjoy ______, he wouldn't have given us ______.",PICK 2
Prompt,"In a pinch, ______ can be a suitable substitute for ______.",PICK 2
Prompt,"In his new self-produced album, Kanye West raps over the sounds of ______.",
Prompt,"In his newest and most difficult stunt, David Blaine must escape from ______.",
Prompt,"In its new tourism campaign, Detroit proudly proclaims that it has finally eliminated ______.",
Prompt,"In Rome, there are whisperings that the Vatican has a secret room devoted to ______.",
Prompt,"In the seventh circle of Hell, sinners must endure ______ for all eternity.",
Prompt,Legend has it Prince wouldn't perform without ______ in his dressing room.,
Prompt,"Listen, son. If you want to get involved with ______, I won’t stop you. Just steer clear of ______.",PICK 2
Prompt,"Little Miss Muffet Sat on a tuffet, Eating her curds and ______.",
Prompt,Lovin’ you is easy ’cause you’re ______.,
Prompt,Members of New York's social elite are paying thousands of dollars just to experience ______.,
Prompt,Michael Bay's new three-hour action epic pits ______ against ______.,PICK 2
Prompt,"Money can’t buy me love, but it can buy me ______.",
Prompt,"My country, 'tis of thee, sweet land of ______.",
Prompt,My gym teacher got fired for adding ______ to the obstacle course.,
Prompt,My life is ruled by a vicious cycle of ______ and ______.,PICK 2
Prompt,My mom freaked out when she looked at my browser history and found ______.com/______.,PICK 2
Prompt,"My new favorite porn star is Joey ""______"" McGee.",
Prompt,My plan for world domination begins with ______.,
Prompt,Next time on Dr. Phil: How to talk to your child about ______.,
Prompt,"Next week on the Discovery Channel, one man must survive in the depths of the Amazon with only ______ and his wits.",
Prompt,Only two things in life are certain: death and ______.,
Prompt,Science will never explain ______.,
Prompt,The blind date was going horribly until we discovered our shared interest in ______.,
Prompt,The CIA now interrogates enemy agents by repeatedly subjecting them to ______.,
Prompt,"The Five Stages of Grief: denial, anger, bargaining, ______, acceptance.",
Prompt,The healing process began when I joined a support group for victims of ______.,
Prompt,"The secret to a lasting marriage is communication, communication, and ______.",
Prompt,This is your captain speaking. Fasten your seatbelts and prepare for ______.,
Prompt,"This month's Cosmo: ""Spice up your sex life by bringing ______ into the bedroom.""",
Prompt,"To prepare for his upcoming role, Daniel Day-Lewis immersed himself in the world of ______.",
Prompt,Tonight on 20/20: What you don't know about ______ could kill you.,
Prompt,Turns out that ______-Man was neither the hero we needed nor wanted.,
Prompt,"Welcome to Señor Frog's! Would you like to try our signature cocktail, “______ on the Beach""?",
Prompt,What brought the orgy to a grinding halt?,
Prompt,What has been making life difficult at the nudist colony?,
Prompt,What left this stain on my couch?,
Prompt,"What's harshing my mellow, man?",
Prompt,"When all else fails, I can always masturbate to ______.",
Prompt,"When I pooped, what came out of my butt?",
Prompt,"When you get right down to it, ______ is just ______.",PICK 2
Prompt,"With enough time and pressure, ______ will turn into ______.",PICK 2
Prompt,You haven't truly lived until you've experienced ______ and ______ at the same time.,PICK 2
Prompt,"Your persistence is admirable, my dear Prince. But you cannot win my heart with ______ alone.",
,,
Response,24-hour media coverage.,
Response,A 55-gallon drum of lube.,
Response,A big black dick.,
Response,"A bigger, blacker dick.",
Response,A black-owned and operated business.,
Response,A bloody pacifier.,
Response,A boo-boo.,
Response,A botched circumcision.,
Response,A Burmese tiger pit.,
Response,A cat video so cute that your eyes roll back and your spine slides out of your anus.,
Response,A complicated relationship with food.,
Response,A cop who is also a dog.,
Response,A crappy little hand.,
Response,A dollop of sour cream.,
Response,A fat bald man from the internet.,
Response,A fortuitous turnip harvest.,
Response,A greased-up Matthew McConaughey.,
Response,A Japanese toaster you can fuck.,
Response,A Japanese tourist who wants something very badly but cannot communicate it.,
Response,A lamprey swimming up the toilet and latching onto your taint.,
Response,A low standard of living.,
Response,A magic hippie love cloud.,
Response,A man in yoga pants with a ponytail and feather earrings.,
Response,A nautical theme.,
Response,A nuanced critique.,
Response,A passionate Latino lover.,
Response,A phantasmagoria of anal delights.,
Response,A pile of squirming bodies.,
Response,A piñata full of scorpions.,
Response,A plunger to the face.,
Response,A PowerPoint presentation.,
Response,A sad fat dragon with no friends.,
Response,A sales team of clowns and pedophiles.,
Response,A slightly shittier parallel universe.,
Response,"A smiling black man, a latina businesswoman, a cool Asian, and some whites.",
Response,"A sofa that says “I have style, but I like to be comfortable.”",
Response,A spontaneous conga line.,
Response,A squadron of moles wearing aviator goggles.,
Response,A surprising amount of hair.,
Response,"A sweaty, panting leather daddy.",
Response,A sweet spaceship.,
Response,A vagina that leads to another dimension.,
Response,A web of lies.,
Response,"Actually getting shot, for real.",
Response,All my friends dying.,
Response,All of this blood.,
Response,An all-midget production of Shakespeare’s Richard III.,
Response,An army of skeletons.,
Response,An ass disaster.,
Response,An ether-soaked rag.,
Response,An Etsy steampunk strap-on.,
Response,An evil man in evil clothes.,
Response,An unhinged ferris wheel rolling toward the sea.,
Response,An unhinged Ferris wheel rolling toward the sea.,
Response,An unstoppable wave of fire ants.,
Response,"André the Giant's enormous, leathery scrotum.",
Response,Another shot of morphine.,
Response,Basic human decency.,
Response,Being a busy adult with many important things to do.,
Response,Being a dinosaur.,
Response,Being a hideous beast that no one could love.,
Response,Being awesome at sex.,
Response,Being black.,
Response,Being fat from noodles.,
Response,Being white.,
Response,Big bad mama nipples.,
Response,"Big Bird's brown, crusty asshole.",
Response,Big ol' floppy titties.,
Response,"Bill Clinton, naked on a bearskin rug with a saxophone.",
Response,Blood farts.,
Response,Blowing some dudes in an alley.,
Response,Boris the Soviet Love Hammer.,
Response,Bosnian chicken farmers.,
Response,Bullshit.,
Response,Buying the right pants to be cool.,
Response,Catastrophic urethral trauma.,
Response,Chugging a lava lamp.,
Response,Clams.,
Response,Clenched butt cheeks.,
Response,Cock.,
Response,Consent.,
Response,Converting to Islam.,
Response,Crabapples all over the fucking sidewalk.,
Response,Crushing Mr. Peanut's brittle body.,
Response,Crying into the pages of Sylvia Plath.,
Response,Cumming deep inside my best bro.,
Response,Dad's funny balls.,
Response,Daddy's belt.,
Response,Death by Steven Seagal.,
Response,Deflowering the princess.,
Response,Demonic possession.,
Response,"Dining with cardboard cutouts of the cast of ""Friends.""",
Response,Dining with cardboard cutouts of the cast of Friends.,
Response,Disco fever.,
Response,Dorito breath.,
Response,Double penetration.,
Response,Drinking my bro's pee-pee right out of his peen.,
Response,Drinking ten 5-hour ENERGYs® to get fifty continuous hours of energy.,
Response,Dying alone and in pain.,
Response,Eating an albino.,
Response,Eating Tom Selleck’s mustache to gain his powers.,
Response,Emotional baggage.,
Response,Enormous Scandinavian women.,
Response,Existing.,
Response,Fabricating statistics.,
Response,Fetal alcohol syndrome.,
Response,Filling every orifice with butterscotch pudding.,
Response,Filling my son with spaghetti.,
Response,Finding Waldo.,
Response,Fisting.,
Response,Flying robots that kill people.,
Response,Four hours of truly goofy sex with the Blue Man Group.,
Response,Fuck Mountain.,
Response,Gandalf.,
Response,Gargling jizz.,
Response,Gay aliens.,
Response,Generational wealth.,
Response,Genetically engineered super-soldiers.,
Response,George Clooney's musk.,
Response,Getting abducted by Peter Pan.,
Response,Getting hilariously gang-banged by the Blue Man Group.,
Response,Getting your dick stuck in a Chinese finger trap with another dick.,
Response,Gladiatorial combat.,
Response,Going around punching people.,
Response,Grandpa's ashes.,
Response,"Graphic violence, adult language, and some sexual content.",
Response,Having $57 in the bank.,
Response,Having a penis.,
Response,Having sex on top of a pizza.,
Response,Having shotguns for legs.,
Response,Hillary Clinton.,
Response,Hipsters.,
Response,Historical revisionism.,
Response,Hot brown piss.,
Response,Hot doooooooogs.,
Response,How awesome it is to be white.,
Response,How wet my pussy is.,
Response,Huge tits and a can-do attitude.,
Response,Indescribable loneliness.,
Response,Insatiable bloodlust.,
Response,Intimacy problems.,
Response,Jafar.,
Response,Jeff Goldblum.,
Response,Jesus.,
Response,Jumping out at people.,
Response,Just the tip.,
Response,Kim Jong-un.,
Response,Letting everyone down.,
Response,Leveling up.,
Response,Literally eating shit.,
Response,Living in a trash can.,
Response,Living in a trashcan.,
Response,"Loki, the trickster god.",
Response,Mad hacky-sack skills.,
Response,Maintaining eye contact with a grown man while he takes a shit.,
Response,Making a friend.,
Response,Making shit up.,
Response,Making the penises kiss.,
Response,Masturbating in a robe like a rich person.,
Response,Maximal insertion.,
Response,Me.,
Response,Medieval Times® Dinner & Tournament.,
Response,Mild autism.,
Response,Mom.,
Response,Mooing.,
Response,Moral ambiguity.,
Response,Mufasa’s death scene.,
Response,Multiple orgasms.,
Response,"My father, who died when I was seven.",
Response,My first kill.,
Response,My machete.,
Response,"My manservant, Claude.",
Response,Neil Patrick Harris.,
Response,Not contributing to society in any meaningful way.,
Response,Not having sex.,
Response,Nothing.,
Response,Nubile slave boys.,
Response,Nunchuck moves.,
Response,Ominous background music.,
Response,Oncoming traffic.,
Response,One Ring to rule them all.,
Response,One thousand Slim Jims.,
Response,Our mutual friend Brad.,
Response,Overpowering your father.,
Response,Power.,
Response,Pretty Pretty Princess Dress-Up Board Game®.,
Response,Pumping out a baby every nine months.,
Response,Putting an entire peanut butter and jelly sandwich into the VCR.,
Response,Quiche.,
Response,Racial profiling.,
Response,Revenge fucking.,
Response,Reverse cowgirl.,
Response,Rich people.,
Response,Ripping into a man's chest and pulling out his still-beating heart.,
Response,Ripping open a man’s chest and pulling out his still-beating heart.,
Response,Rising from the grave.,
Response,"Roland the Farter, flatulist to the king.",
Response,"Running naked through a mall, pissing and shitting everywhere.",
Response,Ryan Gosling riding in on a white horse.,
Response,Samuel L. Jackson.,
Response,Sanding off a man's nose.,
Response,Santa Claus.,
Response,Savagely beating a mascot.,
Response,Screaming like a maniac.,
Response,Scrotal frostbite.,
Response,Scrotum tickling.,
Response,Self-flagellation.,
Response,Sexual humiliation.,
Response,Sexual intercourse.,
Response,Shaft.,
Response,Shitting out a screaming face.,
Response,Shutting the fuck up.,
Response,Sitting on a dick and sipping green tea.,
Response,Slapping a racist old lady.,
Response,"Sneezing, farting, and cumming at the same time.",
Response,Some douche with an acoustic guitar.,
Response,Some kind of bird-man.,
Response,Some really fucked-up shit.,
Response,Sorcery.,
Response,"Special musical guest, Cher.",
Response,Spending lots of money.,
Response,"Staring at a painting and going ""hmmmmmm...""",
Response,Statistically validated stereotypes.,
Response,Stockholm Syndrome,
Response,Subduing a grizzly bear and making her your wife.,
Response,Sudden Poop Explosion Disease.,
Response,Suicidal thoughts.,
Response,Suicide bombers.,
Response,Survivor's guilt.,
Response,Swiftly achieving orgasm.,
Response,Syphilitic insanity.,
Response,Taking a man's eyes and balls out and putting his eyes where his balls go and then his balls in the eye holes.,
Response,That ass.,
Response,The baby that ruined my pussy.,
Response,The black Power Ranger.,
Response,The boners of the elderly.,
Response,The day the birds attacked.,
Response,The economy.,
Response,The entire Internet.,
Response,The flute.,
Response,The four arms of Vishnu.,
Response,The Gulags.,
Response,The Harlem Globetrotters.,
Response,The harsh light of day.,
Response,The hiccups.,
Response,The hose.,
Response,The human body.,
Response,The Land of Chocolate.,
Response,The lingering scent of gardenias.,
Response,The mere concept of Applebee's®.,
Response,The milk that comes out of a person.,
Response,The mixing of the races.,
Response,"The moist, demanding chasm of his mouth.",
Response,The new Radiohead album.,
Response,The ooze.,
Response,The people of Florida.,
Response,"The primal, ball-slapping sex your parents are having right now.",
Response,The prunes I've been saving for you in my armpits.,
Response,The Quesadilla Explosion Salad™ from Chili’s.®,
Response,The shambling corpse of Larry King.,
Response,The systematic destruction of an entire people and their way of life.,
Response,The thin veneer of situational causality that underlies porn.,
Response,The total collapse of the global financial system.,
Response,The way white people is.,
Response,The worst pain imaginable. Times two!,
Response,Three months in the hole.,
Response,Tiny nipples.,
Response,Tongue.,
Response,Tripping balls.,
Response,"Unlimited soup, salad, and breadsticks.",
Response,Velcro™.,
Response,Vietnam flashbacks.,
Response,Vomiting mid-blowjob.,
Response,Walking in on Dad peeing into Mom's mouth.,
Response,"Warm, velvety muppet sex.",
Response,Weapons-grade plutonium.,
Response,Wearing an octopus for a hat.,
Response,Wet butt.,
Response,Whining like a little bitch.,
Response,Whipping a disobedient slave.,
Response,White power.,
Response,"Words, words, words.",
Response,Zeus's sexual appetites.,
Set,Blue Box,BLUE
Prompt,"______ may pass, but ______ will last forever.",PICK 2
Prompt,______ will never be the same after ______.,PICK 2
Prompt,"""This is madness."" ""No, THIS IS ______!""",
Prompt,"2 AM in the city that never sleeps. The door swings open and she walks in, legs up to here. Something in her eyes tells me she's looking for ______.",
Prompt,"Adventure. Romance. ______. From Paramount Pictures, ""______.""",PICK 2
Prompt,And today's soup is Cream of ______.,
Prompt,"And would you like those buffalo wings mild, hot, or ______?",
Prompt,"Armani suit: $1,000. Dinner for two at that swanky restaurant: $300. The look on her face when you surprise her with ______: priceless.",
Prompt,"As king, how will I keep the peasants in line?",
Prompt,Behind every powerful man is ______.,
Prompt,"Come to Dubai, where you can relax in our world-famous spas, experience the nightlife, or simply enjoy ______ by the poolside.",
Prompt,Dammit Gary. You can't just solve every problem with ______.,
Prompt,"Dear Leader Kim Jong-un, our village praises your infinite wisdom with a humble offering of ______.",
Prompt,Do not fuck with me! I am literally ______ right now.,
Prompt,Do the Dew with our most extreme flavor yet! Get ready for Mountain Dew ______!,
Prompt,Do you lack energy? Does it sometimes feel like the whole world is ______ ? Ask your doctor about Zoloft.®,
Prompt,"Don't forget! Beginning this week, Casual Friday will officially become ""______ Friday.""",
Prompt,Don't worry kid. It gets better. I've been living with ______ for 20 years.,
Prompt,Every step towards ______ gets me a little bit closer to ______.,PICK 2
Prompt,Everybody join hands and close your eyes. Do you sense that? That's the presence of ______ in this room.,
Prompt,"Forget everything you know about ______, because now we've supercharged it with ______!",PICK 2
Prompt,Get ready for the movie of the summer! One cop plays by the book. The other's only interested in one thing: ______.,
Prompt,Having the worst day EVER. #______,
Prompt,"Heed my voice, mortals! I am the god of ______ , and I will not tolerate ______!",PICK 2
Prompt,"Help me doctor, I've got ______ in my butt!",
Prompt,"Here at the Academy for Gifted Children, we allow students to explore ______ at their own pace.",
Prompt,"Hi MTV! My name is Kendra, I live in Malibu, I'm into ______, and I love to have a good time.",
Prompt,"Hi, this is Jim from accounting. We noticed a $1,200 charge labeled ""______."" Can you explain?",
Prompt,"Honey, I have a new role-play I want to try tonight! You can be ______, and I'll be ______.",PICK 2
Prompt,How am I compensating for my tiny penis?,
Prompt,"I am become ______, destroyer of ______!",PICK 2
Prompt,"I don't mean to brag, but they call me the Micheal Jordan of ______.",
Prompt,"I have a strict policy. First date, dinner. Second date, kiss. Third date, ______.",
Prompt,"I work my ass off all day for this family, and this is what I come home to? ______!?",
Prompt,"I'm Miss Tennessee, and if I could make the world better by changing one thing, I would get rid of ______.",
Prompt,"I'm pretty sure I'm high right now, because I""m absolutely mesmerized by ______.",
Prompt,"I'm sorry, Mrs. Chen, but there was nothing we could do. At 4:15 this morning, your son succumbed to ______.",
Prompt,"I'm sorry, sir, but we don't allow ______ at the country club.",
Prompt,"If you can't handle ______, you'd better stay away from ______.",PICK 2
Prompt,"If you had to describe the Card Czar, using only one of the cards in your hand, which one would it be?",
Prompt,"In his farewell address, George Washington famously warned Americans about the dangers of ______.",
Prompt,"In his new action comedy, Jackie Chan must fend off ninjas while also dealing with ______.",
Prompt,"In return for my soul, the Devil promised me ______, but all I got was ______.",PICK 2
Prompt,"In the beginning, there was ______. And the Lord said, ""Let there be ______.""",PICK 2
Prompt,"It lurks in the night. It hungers for flesh. This summer, no one is safe from ______.",
Prompt,"James is a lonely boy. But when he discovers a secret door in his attic, he meets a magical new friend: ______.",
Prompt,Life's pretty tough in the fast lane. That's why I never leave the house without ______.,
Prompt,"Listen Gary, I like you. But if you want that corner office, you're going to have to show me ______.",
Prompt,"Man, this is bullshit. Fuck ______.",
Prompt,"My grandfather worked his way up from nothing. When he came to this country, all he had was the shoes on his feet and ______.",
Prompt,"Now in bookstores: ""The Audacity of ______"" by Barack Obama.",
Prompt,"Oprah's book of the month is ""______ For ______: A Story of Hope.""",PICK 2
Prompt,Patient presents with ______. Likely a result of ______.,PICK 2
Prompt,Puberty is a time of change. You might notice hair growing in new places. You might develop an intrest in ______. This is normal.,
Prompt,She's up all night for good fun. I'm up all night for ______.,
Prompt,"The Japanese have developed a smaller, more efficient version of ______.",
Prompt,"The six things I could never do without: oxygen, Facebook, chocolate, Netflix, friends, and ______ LOL!",
Prompt,"This is America. If you don't work hard, you don't succeed. I don't care if you're black, white, purple, or ______.",
Prompt,"This is the prime of my life. I'm young, hot, and full of ______.",
Prompt,"This year's hottest album is ""______"" by ______.",PICK 2
Prompt,"To become a true Yanomami warrior, you must prove that you can withstand ______ without crying out.",
Prompt,"To become a true Yanomamo warrior, you must prove that you can withstand ______ without crying out.",
Prompt,"Tonight we will have sex. And afterwards, If you'd like, a little bit of ______.",
Prompt,"We never did find ______, but along the way we sure learned a lot about ______.",PICK 2
Prompt,"Well if ______ is good enough for ______, it's good enough for me.",PICK 2
Prompt,"Well what do you have to say for yourself, Casey? This is the third time you've been sent to the principal's office for ______.",
Prompt,Wes Anderson's new film tells the story of a precocious child coming to terms with ______.,
Prompt,What killed my boner?,
Prompt,What's fun until it gets weird?,
Prompt,What's making things awkward in the sauna?,
Prompt,"When I was a kid, we used to play Cowboys and ______.",
Prompt,WHOOO! God damn I love ______!,
Prompt,Why am I broke?,
Prompt,Why won't you make love to me anymore? Is it ______?,
Prompt,"Y'all ready to get this thing started? I'm Nick Cannon, and this is America's Got ______.",
Prompt,Yo' mama's so fat she ______!,
Prompt,You are not alone. Millions of Americans struggle with ______ every day.,
Prompt,"You guys, I saw this crazy movie last night. It opens on ______, and then there's some stuff about ______, and then it ends with ______.","DRAW 2, PICK 3"
Prompt,"You know, once you get past ______, ______ ain't so bad.",PICK 2
Prompt,You Won't Believe These 15 Hilarious ______ Bloopers!,
Prompt,"You've seen the bearded lady! You've seen the ring of fire! Now, ladies and gentlemen, feast your eyes upon ______!",
,,
Response,10 Incredible Facts About the Anus.,
Response,40 acres and a mule.,
Response,A bass drop so huge it tears the starry vault asunder to reveal the face of God.,
Response,A bunch of idiots playing a card game instead of interacting like normal humans.,
Response,A buttload of candy.,
Response,A chimpanzee in sunglasses fucking your wife.,
Response,A constant need for validation.,
Response,A crazy little thing called love.,
Response,A dance move that's just sex.,
Response,A disappointing salad.,
Response,A face full of horse cum.,
Response,A fart.,
Response,A for-real lizard that spits blood from its eyes.,
Response,A gender identity that can only be conveyed through slam poetry.,
Response,A giant powdery manbaby.,
Response,A hopeless amount of spiders.,
Response,A horse with no legs.,
Response,A kiss on the lips.,
Response,A lil’ stupid ass bitch.,
Response,A man who is so cool that he rides on a motorcycle.,
Response,A manhole.,
Response,A mouthful of potato salad.,
Response,A Native American who solves crimes by going into the spirit world.,
Response,"A one-way ticket to Gary, Indiana.",
Response,A peyote-fueled vision quest.,
Response,A pizza guy who fucked up.,
Response,A possible Muslim.,
Response,A reason not to commit suicide.,
Response,A self-microwaving burrito.,
Response,A sex comet from Neptune that plunges the Earth into eternal sexiness.,
Response,A sex goblin with a carnival penis.,
Response,A shiny rock that proves I love you.,
Response,A team of lawyers.,
Response,A thrilling chase over the rooftops of Rio de Janeiro.,
Response,A turd.,
Response,A Ugandan warlord.,
Response,A whole lotta woman.,
Response,A whole new kind of porn.,
Response,A woman.,
Response,"A zero-risk way to make $2,000 from home.",
Response,Actual mutants with medical conditions and no superpowers.,
Response,Africa.,
Response,AIDS monkeys.,
Response,All the single ladies.,
Response,All these decorative pillows.,
Response,Almost giving money to a homeless person.,
Response,Ambiguous sarcasm.,
Response,An inability to form meaningful relationships.,
