Set,Red Box,RED
Response,An interracial handshake.,
Response,An oppressed people with a vibrant culture.,
Response,An overwhelming variety of cheeses.,
Response,An unforgettable quinceañera.,
Response,An uninterrupted history of imperialism and exploitation.,
Response,Anal fissures like you wouldn't believe.,
Response,Ancient Athenian boy-fucking.,
Response,Angelheaded hipsters burning for the ancient heavenly connection to the starry dynamo in the machinery of night.,
Response,Ass to mouth.,
Response,Backwards knees.,
Response,Bathing in moonsblood and dancing around the ancient oak.,
Response,Being a terrible mother.,
Response,Being John Malkovich.,
Response,Being nine years old.,
Response,Being paralyzed from the neck down.,
Response,Being popular and good at sports.,
Response,Being worshipped as the one true God.,
Response,Beloved television star Bill Cosby.,
Response,Blackface.,
Response,Blackula.,
Response,Blowjobs for everyone.,
Response,Boring Vaginal sex.,
Response,Bouncing up and down.,
Response,Breastfeeding a ten year old.,
Response,Breastfeeding a ten-year-old.,
Response,Bullets.,
Response,Butt stuff.,
Response,Calculating every mannerism so as not to suggest homosexuality.,
Response,Cancer.,
Response,Changing a person's mind with logic and facts.,
Response,Child Protective Services.,
Response,Child support payments.,
Response,Common-sense gun control legislation.,
Response,"Cool, relatable cancer teens.",
Response,Crazy opium eyes.,
Response,Crippling social anxiety.,
Response,Crying and shitting and eating spaghetti.,
Response,Cute boys.,
Response,Cutting off a flamingo's legs with garden shears.,
Response,Daddy.,
Response,Daddy's credit card.,
Response,Deez nuts.,
Response,Dem titties.,
Response,Depression.,
Response,Doing the right stuff to her nipples.,
Response,Doo-doo.,
Response,Drinking responsibly.,
Response,Eating together like a god damn family for once.,
Response,Eggs.,
Response,Ejaculating inside another man's wife.,
Response,Ejaculating live bees and the bees are angry.,
Response,Ennui.,
Response,Every ounce of charisma left in Mick Jagger's tired body.,
Response,Exploding pigeons.,
Response,Falling into the toilet.,
Response,Figuring out how to have sex with a dolphin.,
Response,Filling a man's anus with concrete.,
Response,Finally finishing off the Indians.,
Response,"Free ice cream, yo.",
Response,Fresh dill from the patio.,
Response,Fucking a corpse back to life.,
Response,Generally having no idea what's going on.,
Response,Genghis Khan's DNA.,
Response,Getting all offended.,
Response,Getting caught by the police and going to jail.,
Response,Getting down to business to defeat the Huns.,
Response,Getting drive-by shot.,
Response,Getting eaten alive by Guy Fieri.,
Response,Getting offended.,
Response,Getting shot by the police.,
Response,Getting shot out of a cannon.,
Response,Giant sperm from outer space.,
Response,"Going down on a woman, discovering that her vagina is filled with eyeballs, and being totally into that.",
Response,Going inside at some point because of the mosquitoes.,
Response,Going to a high school reunion on ketamine.,
Response,Grammar nazis who are also regular Nazis.,
Response,Growing up chained to a radiator in perpetual darkness.,
Response,Gwyneth Paltrow's opinions.,
Response,Having been dead for a while.,
Response,How awesome I am.,
Response,Immortality cream.,
Response,Important news about Taylor Swift.,
Response,Injecting speed into one arm and horse tranquilizer into the other.,
Response,Interspecies marriage.,
Response,Irrefutable evidence that God is real.,
Response,Jizz.,
Response,Kale.,
Response,Khakis.,
Response,Letting out 20 years’ worth of farts.,
Response,Like a million alligators.,
Response,Lots and lots of abortions.,
Response,Meaningless sex.,
Response,Mediocrity.,
Response,Moderate-to-severe joint pain.,
Response,Mom's new boyfriend.,
Response,Morpheus.,
Response,My boyfriend's stupid penis.,
Response,My dad's dumb fucking face.,
Response,My dead son's baseball glove.,
Response,My first period.,
Response,My sex dungeon.,
Response,My worthless son.,
Response,Neil Diamond's Greatest Hits.,
Response,Never having sex again.,
Response,"No clothes on, penis in vagina.",
Response,No longer finding any Cards Against Humanity card funny.,
Response,Not believing in giraffes.,
Response,Oil!,
Response,One unforgettable night of passion.,
Response,Our new Buffalo Chicken Dippers®!,
Response,Out-of-this-world bazongas.,
Response,"Owls, the perfect predator.",
Response,P.F. Chang himself.,
Response,Party Mexicans.,
Response,Peeing into a girl's butt to make a baby.,
Response,Potato.,
Response,"Prince Ali, fabulous he, Ali Ababwa.",
Response,Pussy.,
Response,Rabies.,
Response,Reading the entire End-User License Agreement.,
Response,Ripping a dog in half.,
Response,Robots who just want to party.,
Response,Russian super-tuberculosis.,
Response,Seeing my village burned and my family slaughtered before my eyes.,
Response,Seeing things from Hitler's perspective.,
Response,"September 11th, 2001.",
Response,Setting my balls on fire and cartwheeling to Ohio.,
Response,Shapes and colors.,
Response,Sharks with legs.,
Response,"Shitting all over the floor like a bad, bad girl.",
Response,Slowly easing down onto a cucumber.,
Response,"Smoking crack, for instance.",
Response,Snorting coke off a clown's boner.,
Response,Social justice warriors with flamethrowers of compassion.,
Response,Some shit-hot guitar licks.,
Response,Some sort of Asian.,
Response,Sports.,
Response,Storing a bunch of acorns in my pussy.,
Response,Stuffing a child's face with Fun Dip® until he starts having fun.,
Response,Stupid.,
Response,Such a big boy.,
Response,Sucking all the milk out of a yak.,
Response,Sudden penis loss.,
Response,Teaching a girl how to handjob the penis.,
Response,Texas.,
Response,The Abercrombie & Fitch lifestyle.,
Response,The all-new Nissan Pathfinder with 0.9% APR financing!,
Response,The amount of gay I am.,
Response,The basic suffering that pervades all of existence.,
Response,The best taquito in the galaxy.,
Response,The black half of Barack Obama.,
Response,"The color ""puce"".",
Response,The complex geopolitical quagmire that is the Middle East.,
Response,The dentist.,
Response,The eight gay warlocks who dictate the rules of fashion.,
Response,The eighth graders.,
Response,The euphoric rush of strangling a drifter.,
Response,The ghost of Marlon Brando.,
Response,The haunting stare of an Iraqi child.,
Response,The inability to form meaningful relationships.,
Response,The male gaze.,
Response,The passage of time.,
Response,The peaceful and nonthreatening rise of China.,
Response,The power of the Dark Side.,
Response,The right amount of cocaine.,
Response,The safe word.,
Response,The secret formula for ultimate female satisfaction.,
Response,The size of my penis.,
Response,The sweet song of sword against sword and the braying of mighty war beasts.,
Response,"The swim team, all at once.",
Response,The tiger that killed my father.,
Response,The tiniest shred of evidence that God is real.,
Response,The unbelievable world of mushrooms.,
Response,The white half of Barack Obama.,
Response,Three consecutive seconds of happiness.,
Response,Throwing stones at a man until he dies.,
Response,Too much cocaine.,
Response,Total fucking chaos.,
Response,Treasures beyond your wildest dreams.,
Response,Turning the rivers red with the blood of infidels.,
Response,Two whales fucking the shit out of each other.,
Response,Unquestioning obedience.,
Response,Unrelenting genital punishment.,
Response,Unsheathing my massive horse cock.,
Response,Vegetarian options.,
Response,Walking into a glass door.,
Response,Wearing glasses and sounding smart.,
Response,Western standards of beauty.,
Response,What Jesus would do.,
Response,Whatever a McRib® is made of.,
Response,"Whatever you wish, mother.",
Response,Whispering all sexy.,
Set,Green Box,GREEN
Prompt,______ be all like ______.,PICK 2
Prompt,______: Brought to you by ______.,PICK 2
Prompt,Art isn’t just a painting in a stuffy museum. Art is alive. Art is ______.,
Prompt,"As reparations for slavery, all African Americans will receive ______.",
Prompt,"As Teddy Roosevelt said, the four manly virtues are honor, temperance, industry, and ______.",
Prompt,"Best you go back where you came from, now. We don’t take too kindly to ______ in these parts.",
Prompt,CNN breaking news! Scientists discover ______.,
Prompt,"Coming to Red Lobster® this month, ______.",
Prompt,"Congratulations! You have been selected for our summer internship program. While we are unable to offer a salary, we can offer you ______.",
Prompt,"Dance like there’s nobody watching, love like you’ll never be hurt, and live like you’re ______.",
Prompt,Errbody in the club ______.,
Prompt,Feeling so grateful! #amazing #mylife #______.,
Prompt,Girls just wanna have ______.,
Prompt,Google Calendar alert: ______ in 10 minutes.,
Prompt,I don’t believe in God. I believe in ______.,
Prompt,"I got rhythm, I’ve got music, I’ve got ______. Who could ask for anything more?",
Prompt,"I may not be much to look at, but I fuck like ______.",
Prompt,"I tell you, it was a non-stop fuckfest. When it was over, my asshole looked like ______.",
Prompt,I’ll take the BBQ bacon burger with friend egg and fuck it how about ______.,
Prompt,"I’m sorry, sir, but your insurance plan doesn’t cover injuries caused by ______.",
Prompt,"I’ve had a horrible vision, father. I saw mountains crumbling, stars falling from the sky. I saw ______.",
Prompt,"If at first you don’t succeed, try ______.",
Prompt,"In the 1950s, psychologists prescribed ______ as a cure for homosexually.",
Prompt,LSD + ______ = really bad time.,
Prompt,"Mom’s to-do list:
 * Buy Groceries
 * Clean up ______.
 * Soccer Practice.",
Prompt,Most Americans would not vote for a candidate who is openly ______.,
Prompt,"No, no, no, no, no, no, NO! I will NOT let ______ ruin this wedding.",
Prompt,"Oh no! Siri, how do I fix ______?",
Prompt,One more thing. Watch out for Big Mike. They say he killed a man with ______.,
Prompt,"Ooo, daddy like ______.",
Prompt,"Poor Brandon, still living in his parent’s basement. I heard he never got over ______.",
Prompt,"Run, run, as fast as you can! You can’t catch me, I’m ______!",
Prompt,"She’s a lady in the streets, ______ in the sheets.",
Prompt,"She’s just one of the guys, you know? She likes beer, and football, and ______.",
Prompt,"Son, take it from someone who’s been around the block a few times. Nothin’ puts her in the mood like ______.",
Prompt,"Summer lovin’, had me a blast. ______, happened so fast.",
Prompt,"The top Google auto-complete results for “Barack Obama”:
Barack Obama Height.
Barack Obama net worth.
Barack Obama ______.",
Prompt,"Then the princess kissed the frog, and all of a sudden the frog was ______!",
Prompt,There is no God. It’s just ______ and then you die.,
Prompt,"This Friday at the Liquid Lunge, it’s ______ Night! Ladies drink free.",
Prompt,We do not shake with our left hands in this country. That is the hand we use for ______.,
Prompt,"Well if ______ is a crime, then lock me up!",
Prompt,"Well, shit. My eyes ain’t so good, but I’ll eat my own boot if that ain’t ______!",
Prompt,What are all those whales singing about?,
Prompt,What sucks balls?,
Prompt,What totally destroyed my asshole?,
Prompt,What turned me into a Republican?,
Prompt,What will end racism once and for all?,
Prompt,What’s a total waste of Hillary Clinton’s time?,
Prompt,What’s about to take dance floor to the next level?,
Prompt,What’s the gayest?,
Prompt,What’s the most problematic?,
Prompt,Why am I laughing and crying and taking off my clothes?,
Prompt,"With a one-time gift of just $10, you can save this child from ______.",
Prompt,You know who else liked ______? Hitler.,
Prompt,You won’t believe what’s in my pussy. It’s ______.,
,,
Response,10 football players with erections barrelling towards you at full speed.,
Response,"10,000 shrieking teenage girls.",
Response,A big ol’ plate of fettuccini alfredo.,
Response,"A big, beautiful mouth packed to the brim with sparkling white teeth.",
Response,A black friend.,
Response,A burrito that’s just sour cream.,
Response,A cheerfulness that belies a deep-seated self-loathing.,
Response,A cold and indifferent universe.,
Response,A creature made of penises that must constantly arouse itself to survive.,
Response,A creepy child singing a nursery rhyme.,
Response,A dolphin that learns to talk and becomes the Dean of Harvard Law School.,
Response,A duffel bag full of lizards.,
Response,A finger up the butt.,
Response,A genetic predisposition for alcoholism.,
Response,A gun that shoots cobras.,
Response,A hug.,
Response,A long business meeting with no obvious purpose.,
Response,A man in a suit with perfect hair who tells you beautiful lies.,
Response,A man with the head of a goat and the body of a goat.,
Response,A massive collection of child pornography.,
Response,A medium horchata.,
Response,A negative body image that is totally justified.,
Response,A slowly encroaching circle of wolves.,
Response,A strong horse and enough rations for thirty days.,
Response,A terrified fat child who won’t come out of the bushes.,
Response,A tiny fireman who puts out tiny fires.,
Response,A weird guy who says weird stuff and weirds me out.,
Response,A woman’s perspective.,
Response,A woman’s right to choose.,
Response,Aborting the shit out of a fetus.,
Response,Albert Einstein but if he had huge muscles and a rhinoceros cock.,
Response,All the people I’ve killed.,
Response,An arrangement wherein I give a person money and they have sex with me.,
Response,An empowered woman.,
Response,An incurable homosexual.,
Response,An old dog dragging its anus across the floor.,
Response,An old dog full of tumors.,
Response,An older man.,
Response,An X-Man whose power is that he has sex with dogs and children.,
Response,Anal.,
Response,Antidepressants.,
Response,Art.,
Response,Assassinating the president.,
Response,Awesome pictures of planets and stuff.,
Response,Bad emotions I don’t want.,
Response,Becoming the President of the United States.,
Response,Being sexually attracted to children.,
Response,Being turned into sausages.,
Response,Beyoncé.,
Response,"Big, smart money boys tap-tapping on their keyboards.",
Response,Blossoming into a beautiful young woman.,
Response,Breastfeeding in public like a radiant earth goddess.,
Response,Brunch.,
Response,Catching a live salmon in your mouth.,
Response,Child labor.,
Response,China.,
Response,Chipotle.,
Response,Chris Hemsworth.,
Response,Comprehensive immigration reform.,
Response,Condoleezza Rice.,
Response,"Consensual, nonreproductive incest.",
Response,Content.,
Response,Crazy anal orgasms.,
Response,"Creamy slices of real, California avocado.",
Response,Critical thinking.,
Response,Crushing the patriarchy.,
Response,Daddy going away forever.,
Response,Defeating a gorilla in single combat.,
Response,Denying the Holocaust.,
Response,Dis bitch.,
Response,Discovering that what I really want in life is to kill people and have sex with their corpses.,
Response,Doing a somersault and barfing.,
Response,Dominating a man by peeing on his eldest son.,
Response,Doritos and a Fruit Roll-Up.,
Response,Dropping dead in a Sbarro’s bathroom and not being found for 72 hours.,
Response,Dumpster juice.,
Response,Eating ass.,
Response,Eating people.,
Response,Eating too many Cinnabons and then vomiting and then eating the vomit.,
Response,Ejaculating at the apex of a cartwheel.,
Response,"Esmeralda, my most beautiful daughter.",
Response,Eternal screaming madness.,
Response,Every man’s ultimate fantasy: a perfectly cylindrical vagina.,
Response,Everything.,
Response,Exploring each other’s buttholes.,
Response,Facilitating dialogue and deconstructing binaries.,
Response,Falling into a pit of waffles.,
Response,Farting a huge shit out of my pussy.,
Response,Farting all over my face with your tight little asshole.,
Response,Feeling the emotion of anger.,
Response,Feminism.,
Response,Film roles for actresses over 40.,
Response,Finding a nice elevator to poop in.,
Response,Forty-five minutes of finger blasting.,
Response,Founding a major world religion.,
Response,Fucking me good and taking me to Red Lobster.®,
Response,Fucking my therapist.,
Response,Gary.,
Response,Gay thoughts.,
Response,Gayle from HR.,
Response,Gazpacho.,
Response,Getting aborted.,
Response,Getting blasted in the face by a t-shirt cannon.,
Response,Getting eaten out by a dog.,
Response,Getting high with mom.,
Response,Getting killed and dragged up a tree by a leopard.,
Response,Getting laid like all the time.,
Response,Getting naked too soon.,
Response,Getting pegged.,
Response,Getting the Dorito crumbs out of my pubes.,
Response,Getting this party started!,
Response,Getting trapped in a conversation about Ayn Rand.,
Response,Going around pulling people’s tampons out.,
Response,Going to bed at a reasonable hour.,
Response,"Gregor, my largest son.",
Response,Grunting for ten minutes and then peeing sand.,
Response,Guns.,
Response,Happy daddies with happy sandals.,
Response,Hating Jews.,
Response,Having a vagina.,
Response,Having an awesome time drinking and driving.,
Response,Having sex with a beautiful person.,
Response,Having sex with a man and then eating his head.,
Response,Having sex with your mom.,
Response,Holding the proper political beliefs of my time to attract a mate.,
Response,Homework.,
Response,Hot lettuce.,
Response,How good lead paint taste.,
Response,How great my ass looks in these jeans.,
Response,How sad it will be when Morgan Freeman dies.,
Response,How strange it is to be anything at all.,
Response,Huge big balls full of jizz.,
Response,Informing you that I am a registered sex offender.,
Response,ISIS.,
Response,It being too late to stop having sex with a horse.,
Response,"Jason, the teen mayor.",
Response,Jazz.,
Response,Just now finding out about the Armenian Genocide.,
Response,Late-stage dementia.,
Response,Libertarians.,
Response,"Loud, scary thunder.",
Response,Making out and stuff.,
Response,Math.,
Response,"Meatloaf, the food.",
Response,"Meatloaf, the man.",
Response,Menopause.,
Response,Mental illness.,
Response,Microaggressions.,
Response,Misogyny.,
Response,Mixing M&Ms and Skittles like some kind of psychopath.,
Response,Mommy and daddy fighting all the time.,
Response,Moon people.,
Response,Munchin’ puss.,
Response,My brother’s hot friends.,
Response,My dog dying.,
Response,My huge penis and substantial fortune.,
Response,Objectifying women.,
Response,One of them big-city Jew lawyers.,
Response,One of those “blow jobs” I’ve been hearing so much about.,
Response,Onions.,
Response,Opening your mouth to talk and a big penis flops out.,
Response,Our baby.,
Response,Out-of-control teenage blowjob parties.,
Response,Overthrowing the democratically-elected government of Chile.,
Response,Participating.,
Response,Period poops.,
Response,Picking up a glass of water and taking a sip and being the president.,
Response,Playing my asshole like a trumpet.,
Response,Plowing that ass like a New England corn farmer.,
Response,Political correctness.,
Response,Pooping in a leotard and hoping no one notices.,
Response,Pooping in the potty.,
Response,Prematurely ejaculating like a total loser.,
Response,Pretending to be one of the guys but actually being the spider god.,
Response,Putting more black people in jail.,
Response,Quacking like a duck in lieu of a cogent argument.,
Response,Quinoa.,
Response,Raising three kids on minimum wage.,
Response,Reaching an age where barbecue chips are better than sex.,
Response,Regurgitating a half-digested sparrow.,
Response,Restoring Germany to its former glory.,
Response,Rock-hard tits and a huge vagina.,
Response,Rolling so hard.,
Response,Rubbing my bush all over your bald head.,
Response,Salsa Night at Dave’s Cantina.,
Response,"Scissoring, if that’s a thing.",
Response,Seizing control of the means of production.,
Response,Self-identifying as a DJ.,
Response,Showering praise upon the Sultan’s hideous daughters.,
Response,Showing all the boys my pussy.,
Response,Slamming a dunk.,
Response,Smashing my balls at the moment of climax.,
Response,Some of that good dick.,
Response,Some real spicy shrimps.,
Response,Starting a shitty podcast.,
Response,Straight blazin’ 24/7.,
Response,Sucking each other’s penises for hours on end.,
Response,Sudden and unwanted slam poetry.,
Response,Systems and policies designed to preserve centuries-old power structures.,
Response,Tables.,
Response,Taking the form of a falcon.,
Response,Tender chunks of all-white-meat chicken.,
Response,"That bitch, Stacy.",
Response,That chicken from Popeyes. ®,
Response,The amount of baby carrots I can fit up my ass.,
Response,"The best, deepest quotes from The Dark Knight.",
Response,The body of a 46-year-old man.,
Response,The bond between a woman and her horse.,
Response,The clown that followed me home from the grocery store.,
Response,The fear and hatred in men’s hearts.,
Response,The feeling of going to McDonald’s as a 6-year-old.,
Response,The flaming wreckage of the International Space Station.,
Response,The full force of the American military.,
Response,The full-blown marginalization of ugly people.,
Response,The government.,
Response,The graceful path of an autumn leaf as it falls to its earthen cradle.,
Response,The hottest MILF in Dallas.,
Response,The LGBT community.,
Response,The lived experience of African Americans.,
Response,The mysterious fog rolling into town.,
Response,The ol’ penis-in-the-popcorn surprise.,
Response,The Rwandan Genocide.,
Response,The secret to truly resilient hair.,
Response,"The sweet, forbidden meat of the monkey.",
Response,The wind.,
Response,Thinking about what eating even is.,
Response,Three hours of nonstop penetration.,
Response,"Tiny, rancid girl farts.",
Response,Trees.,
Response,"Trevor, the world’s greatest boyfriend.",
Response,Turning 32.,
Response,Twenty bucks.,
Response,Twenty cheerleaders laughing at your tiny penis.,
Response,Twisting my cock and balls into a balloon poodle.,
Response,Two beautiful pig sisters.,
Response,Two shitty kids and a garbage husband.,
Response,Waking up inside of a tornado.,
Response,Watching a hot person eat.,
Response,Watching you die.,
Response,Water.,
Response,When the big truck goes “Toot! Toot!”,
Response,Who really did 9/11.,
Response,Whomsoever let the dogs out.,
Response,Whooping your ass at Mario Kart.,
Response,Working so hard to have muscles and then having them.,
Response,You.,
Set,Absurd Box,ABSURD
Prompt,Ain't it nifty? Barb and Bob hit 50! So get off your ass and raise a glass to 50 years of ______.,
Prompt,Duuuuuuude. You have got to go to space. ______ is awesome in space.,
Prompt,"Five,
four,
three,
two,
one….
______!",
Prompt,"For hunting in the King's forest, I hereby sentence you to death by ______.",
Prompt,Give me ten good men and 48 hours. I'll get you ______.,
Prompt,"Goldfinger!
He's the man,
the man with _______.",
Prompt,"Goodbye, ______, hello _____!",PICK 2
Prompt,Here's a little something I learned in business school: The customer is always ______.,
Prompt,"Hey, honey.
For the bedroom, were you thinking, ""Robin's Egg Blue"" or ______Pink?""",
Prompt,"I hate this job.
I hate this place.
Most of all, I hate ______.
I quit.",
Prompt,"I have solved politics.
My solution is ______.",
Prompt,I so drunk I ______.,
Prompt,I swear to God I'm gonna murder my husband if he doesn't shut the fuck up about ______.,
Prompt,"In bookstores now: ""From ______ to ______: A memoir.""",PICK 2
Prompt,"In Radiohead's new single, Thom Yorke repeats the phrase ""______"" dozens of times over a skittering drum beat.",
Prompt,It's finally happening! I'm finally doing it! Yes! It's time for ______!,
Prompt,"It's late at night. You're in bed with your lover, Patrick Stewart. He leans over with a twinkle in his eye and asks ""How about ______?""",
Prompt,"It's the 21st century.
A woman shouldn't have to apologize for ______.",
Prompt,"Ladies and gentlemen, I propose a two-pronged plan. The first prong will be ______, and the second prong will be ______.",PICK 2
Prompt,"Live from Universal Studios, it's America's favorite game show! ""______ or ______?""",PICK 2
Prompt,"Millions of copies sold! Donald Trump's ""The Art of _______.""",
Prompt,New at TGI Fridays! It's what you've been waiting for: The ______ Burger.,
Prompt,"Oh no!
Here it comes!
Ohhhhh god!
It's ______.",
Prompt,"Oh you haaaaaaave to see this new documentary on Netflix. I don't want to give anything away, but let's just say it will change the way you look at ______.",
Prompt,"Oh, the weather outside is frightful. But ______ is so delightful.",
Prompt,"One, two, three and to the four, Snoop Doggy Dogg and Dr. Dre is ______.",
Prompt,Personal foul: ______. 15-yard penalty. Automatic first down.,
Prompt,"Rub a dub dub, ______ in a tub!",
Prompt,Say it loud! I'm ______ and I'm proud!,
Prompt,"Seriously guys, there's nothing funny about ______.",
Prompt,"Sweetheart, you and your sister escel in different ways. She's got her violin, and you've got ______.",
Prompt,That's bullshit! They can't fire me for _______!,
Prompt,The sequel is here! Get Ready for ______2: ______.,PICK 2
Prompt,"Times have changed, girlfriend. If you want to meet people in New York, you got to be down for _______.",
Prompt,"Unfortunately, no one can be told what ______ is. You have to experience it for yourself.",
Prompt,"What has my life become? I'm jerking off to a video called ""co-ed absolutely destroyed by ______.""",
Prompt,What sounds great after four margaritas?,
Prompt,"What's hot, smelly, and about to die?",
Prompt,What's secretly a Russian plot to destabilize the West?,
Prompt,"What's up, YouTube?
User DanTheMan wanted to see ______, so here we go.",
Prompt,Why did the chicken cross the road?,
Prompt,Why my mustache smell so bad?,
